web_scraper_order,web_scraper_start_url,pagination,comment,date,data6,data7
"1773397937-220","https://shopee.vn/buyer/1363386527/rating?shop_id=1362679168","","❌SHOP KHÔNG MUỐN HỖ TRỢ KH
Mình oder cây son của shop và chưa hề qua sử dụng hay test sản phẩm lên bất kỳ đâu. Sau khi xem thì mình thấy màu không như mô tả nên đã quyết định trả hàng song song đó mình có oder thêm 1 màu mới nhưng shop và shopee lại một mực nói sản phẩm đã có dấu hiệu sử dụng và do sắc tố môi  nên màu thay đổi nhưng không có bất kỳ 1 bằng chứng nào cho việc đó
Shopee gọi mình trong vòng 1 tiếng 3 cuộc và mình đang đi làm không thể nhấc máy, mình đã cố gắng liên hệ lại nhưng không được và có nhờ shop hỗ trợ nhưng shop lại đổ hết qua cho shopee, thế là shopee tự ý đánh giá không chấp nhận yêu cầu và hoàn hàng về cho mình trong 1 tiếng khi chưa có sự chấp thuận của 2 bên
Đơn hàng mình gửi trả shop còn nguyên seal nguyên kiện như hình, thậm chí bây giờ shopee gửi lại cho mình thì miệng son vẫn như mới. Mình đã nhắn tin nhờ shop hỗ trợ nhưng shop cứ đỗ qua cho shopee và không có 1 động thái hỗ trợ nào cho khách hàng. Một người mua sản phẩm của 3CE rất nhiều từ các sàn TMĐT, đây là lần đầu gặp phải trường hợp này :))) nếu shop thấy được đánh giá này vui lòng thay đổi cách làm việc của mình đi nhé !","2026-02-10 17:38 | Phân loại hàng: 04 - Pink Scheme","Phân loại hàng: 04 - Pink Scheme","Son Pha Lê 3CE Misty Lip Bare"
"1773397937-221","https://shopee.vn/buyer/1363386527/rating?shop_id=1362679168","","sản phẩm không giống hình gửi trả son mà nói serum con mẹ tụi m hãng lớn mà làm ăn như quần què người ta","2026-02-10 17:37 | Phân loại hàng: 04 - Pink Scheme","Phân loại hàng: 04 - Pink Scheme","Son Pha Lê 3CE Misty Lip Bare"
"1773397937-222","https://shopee.vn/buyer/1363386527/rating?shop_id=1362679168","","Ảnh minh họa. Dùng hơi khô môi. Sản phẩm dùng hơi chán. ……………","2026-02-10 14:51 | Phân loại hàng: Sepia-Đỏ táo trầm","Phân loại hàng: Sepia-Đỏ táo trầm","Son Kem 3CE Cho Viền Môi Mờ Ảo Không Lem Blur Water Tint 4.6g"
"1773397937-223","https://shopee.vn/buyer/1363386527/rating?shop_id=1362679168","","","2026-02-10 14:40 | Phân loại hàng: Sepia-Đỏ táo trầm","Phân loại hàng: Sepia-Đỏ táo trầm","Son Kem 3CE Cho Viền Môi Mờ Ảo Không Lem Blur Water Tint 4.6g"
"1773397937-224","https://shopee.vn/buyer/1363386527/rating?shop_id=1362679168","","","2026-02-10 12:21 | Phân loại hàng: #32 PEACHY FILLI","Phân loại hàng: #32 PEACHY FILLI","Son bóng dưỡng môi 3CE GLAZY LIP GLOW"
"1773397937-225","https://shopee.vn/buyer/1363386527/rating?shop_id=1362679168","","","2026-02-10 11:57","","(GWP) 3CE Mini Square Metal Mirror Gương Vuông Kim Loại Mini 3CE | 3CE Official Store"
"1773397937-226","https://shopee.vn/buyer/1363386527/rating?shop_id=1362679168","","","2026-02-10 11:56","","(GWP) 3CE Mini Square Metal Mirror Gương Vuông Kim Loại Mini 3CE | 3CE Official Store"
"1773397937-227","https://shopee.vn/buyer/1363386527/rating?shop_id=1362679168","","Màu son không đúng mô tả của hãng. Bà nào vẫn cố chấp muốn mua thì nhắn t để lại gia rẻ cho trải nghiệm :)) full box mới quẹt đúng 1 lần còn chưa chạm thành vỏ. khong ba nam chin mot hai khong bay chin mot","2026-02-10 11:24 | Phân loại hàng: Dear March-Cam nude","Phân loại hàng: Dear March-Cam nude","Son Kem 3CE Cho Viền Môi Mờ Ảo Không Lem Blur Water Tint 4.6g"
"1773397937-228","https://shopee.vn/buyer/1363386527/rating?shop_id=1362679168","","","2026-02-10 03:40","","(GWP) 3CE Mini Square Metal Mirror Gương Vuông Kim Loại Mini 3CE | 3CE Official Store"
"1773397937-229","https://shopee.vn/buyer/1363386527/rating?shop_id=1362679168","","Mình mua trên live 2.2 Hannah và nhận về sp ""in 2 dấu tay đã test/sử dụng trên sp"". Sau khi mình làm căng với kol thì brand báo mình đợi hàng 15-20 ngày hoặc hoàn hàng (trong khi kho còn stock mà k đổi ngay). Hannah thì kêu thông cảm hoàn 3.3 mua lại chứ k hỗ trợ :)). Sau khi mình lên bài thì có bạn cmt cũng bị giống mình. Mình nghi brand lấy hàng khách hoàn về đóng seal mới gửi khách lần 2. Mng mua hàng lưu ý nhé","2026-02-10 03:40 | Phân loại hàng: Early Now","Phân loại hàng: Early Now","Phấn Má Hồng Bắt Sáng 3CE Blushlighter"
"1773397937-230","https://shopee.vn/buyer/1363386527/rating?shop_id=1362679168","","K như review","2026-02-09 21:45 | Phân loại hàng: Laydown-Hồng trầm","Phân loại hàng: Laydown-Hồng trầm","Son Kem 3CE Cho Viền Môi Mờ Ảo Không Lem Blur Water Tint 4.6g"
"1773397937-231","https://shopee.vn/buyer/1363386527/rating?shop_id=1362679168","","Màu ko như hình, vỏ hộp kiêm tra như đã có ai mở,lọ son như đã qua sử dụng","2026-02-09 19:48 | Phân loại hàng: #07 Dusky Pink","Phân loại hàng: #07 Dusky Pink","Son Kem Lì Nhung Mịn 3CE Velvet Lip Tint Plush"
"1773397937-232","https://shopee.vn/buyer/1363386527/rating?shop_id=1362679168","","Màu lê đỏ ngâm nhưng không có gì là màu đỏ chỉ có màu hồng rất rõ. Sau khi đánh lên rồi chùi bớt hoặc ăn uống sẽ chỉ còn 1 lớp màu hồng không khác vào đâu được. Túm lại đây là son màu HỒNG không phải đỏ!","2026-02-09 16:31 | Phân loại hàng: Speak Up-Lê đỏ ngâm","Phân loại hàng: Speak Up-Lê đỏ ngâm","Son kem lì nhung mịn 3CE Velvet Lip Tint"
"1773397937-233","https://shopee.vn/buyer/1363386527/rating?shop_id=1362679168","","","2026-02-09 13:17 | Phân loại hàng: 05 - Coral Drench","Phân loại hàng: 05 - Coral Drench","Son Pha Lê 3CE Misty Lip Bare"
"1773397937-234","https://shopee.vn/buyer/1363386527/rating?shop_id=1362679168","","màu xấu","2026-02-09 13:16","","(GWP) 3CE Mini Square Metal Mirror Gương Vuông Kim Loại Mini 3CE | 3CE Official Store"
"1773397937-235","https://shopee.vn/buyer/1363386527/rating?shop_id=1362679168","","","2026-02-09 11:07 | Phân loại hàng: 03 - Milky Illusion","Phân loại hàng: 03 - Milky Illusion","Son Pha Lê 3CE Misty Lip Bare"
"1773397937-236","https://shopee.vn/buyer/1363386527/rating?shop_id=1362679168","","Tệ","2026-02-09 10:38 | Phân loại hàng: Rose Beige-Cam đào","Phân loại hàng: Rose Beige-Cam đào","Phấn Má Hồng Mịn Lì 3CE Face Blush"
"1773397937-237","https://shopee.vn/buyer/1363386527/rating?shop_id=1362679168","","","2026-02-09 10:31","","(GWP) Túi Mini Đựng Son 3CE Lipstick Holder"
"1773397937-238","https://shopee.vn/buyer/1363386527/rating?shop_id=1362679168","","Sản phẩm tệ, lên màu k rõ, 3ce làm ăn vô trách nhiệm, tẩy chay","2026-02-09 10:31 | Phân loại hàng: Rose Beige-Cam đào","Phân loại hàng: Rose Beige-Cam đào","Phấn Má Hồng Mịn Lì 3CE Face Blush"
"1773397937-239","https://shopee.vn/buyer/1363386527/rating?shop_id=1362679168","","","2026-02-09 02:38","","(GWP) Túi Mini Đựng Son 3CE Lipstick Holder"
"1773397937-240","https://shopee.vn/buyer/1363386527/rating?shop_id=1362679168","","Trung. Bảo sao bữa dùng đc 2 lần đã rớt ra. Bh mới phát hiện ra. Thôi từ nay né. Ham rẻ nên mua.","2026-02-09 02:38 | Phân loại hàng: Delectable-Hồng dâu, Mono Pink-Hồng khô","Phân loại hàng: Delectable-Hồng dâu","Phấn Má Hồng Mịn Lì 3CE Face Blush"
"1773397937-241","https://shopee.vn/buyer/1363386527/rating?shop_id=1362679168","","Mình hỏi shop nền môi của mình sẵn như này thì dùng màu nào cho tươi. Shop bảo mình mua 04. Và đây là kết quả.còn thâm hơn cả màu môi gốc, bôi mấy lớp mới lên được màu còn ko thì ko có 1 tí nào khác môi ban đầu. Mn nhìn viền môi mình là biết màu có lên được ko.khuyên chân thành mn ko nên mua phí tiền","2026-02-09 02:24 | Phân loại hàng: 04 - Pink Scheme","Phân loại hàng: 04 - Pink Scheme","Son Pha Lê 3CE Misty Lip Bare"
"1773397937-242","https://shopee.vn/buyer/1363386527/rating?shop_id=1362679168","","","2026-02-09 01:13","","(GWP) Túi Mini Đựng Son 3CE Lipstick Holder"
"1773397937-243","https://shopee.vn/buyer/1363386527/rating?shop_id=1362679168","","Xấu","2026-02-08 22:49","","(GWP) Túi Mini Đựng Son 3CE Lipstick Holder"
"1773397937-244","https://shopee.vn/buyer/1363386527/rating?shop_id=1362679168","","","2026-02-08 22:02 | Phân loại hàng: Private-Đỏ lạnh","Phân loại hàng: Private-Đỏ lạnh","Son kem lì nhung mịn 3CE Velvet Lip Tint"
"1773397937-245","https://shopee.vn/buyer/1363386527/rating?shop_id=1362679168","","","2026-02-08 20:56 | Phân loại hàng: Speak Up-Lê đỏ ngâm","Phân loại hàng: Speak Up-Lê đỏ ngâm","Son kem lì nhung mịn 3CE Velvet Lip Tint"
"1773397937-246","https://shopee.vn/buyer/1363386527/rating?shop_id=1362679168","","Cho 1 sao.","2026-02-08 20:55 | Phân loại hàng: Taupe-Gạch đỏ","Phân loại hàng: Taupe-Gạch đỏ","Son kem lì nhung mịn 3CE Velvet Lip Tint"
"1773397937-247","https://shopee.vn/buyer/1363386527/rating?shop_id=1362679168","","Chất như 💩 , khó tán vô cùng , màu thấy ghê . Không nên mua nha mọi người phí tiền , rất bực mình hoàn hàng còn k được chấp nhận . Không có ảnh vì test 1 lần thấy ghê quá k buồn chụp lại","2026-02-08 17:21 | Phân loại hàng: Sepia-Đỏ táo trầm","Phân loại hàng: Sepia-Đỏ táo trầm","Son Kem 3CE Cho Viền Môi Mờ Ảo Không Lem Blur Water Tint 4.6g"
"1773397937-248","https://shopee.vn/buyer/1363386527/rating?shop_id=1362679168","","duong moi nhưng thật ra thì bóng nhẹ sau đó biến mất, k thấy dưỡng gì cả, độ bền màu lại cực kỳ kém luôn, nói chung tệ, giá thì chát, quãng cáo seêding hình ảnh ng nổi tiếng đồ ầm ầm mà chất lượng dưỡng cũng k có dưỡng, màu thì nhạt toe k có gì ấn tượng, bền màu cũng kém như 1 cây son bóng cũng k phải, như 1 cây son bình thường cũng k tốt, như 1 cây son dưỡng cũng k ổn luôn. Hoàn đơn thì không đc mấy má cân nhắc, dùng xong còn bị khô môi, bỏ ra 500k cho 2 cây son thật sự là đơn Shopee phí tiền nhất năm nay trời ơiiii","2026-02-08 15:09","","(GWP) 3CE Mini Square Metal Mirror Gương Vuông Kim Loại Mini 3CE | 3CE Official Store"
"1773397937-249","https://shopee.vn/buyer/1363386527/rating?shop_id=1362679168","","","2026-02-08 15:09 | Phân loại hàng: #36 Double Grape, #34 Rose Glaze","Phân loại hàng: #36 Double Grape","Son bóng dưỡng môi 3CE Glazy Lip Glow"
"1773397937-250","https://shopee.vn/buyer/1363386527/rating?shop_id=1362679168","","","2026-02-08 12:50","","(GWP) 3CE Mini Square Metal Mirror Gương Vuông Kim Loại Mini 3CE | 3CE Official Store"
"1773397937-251","https://shopee.vn/buyer/1363386527/rating?shop_id=1362679168","","Lúc mở hàng son đã có dấu hiệu bị unbox từ trc 
Săn sale của Hana Olala nên giá khá rẻ nhưng không đồng nghĩa với việc tôi phải nhận hàng với sự thiếu chu đáo và thiếu tôn trọng.","2026-02-08 12:50 | Phân loại hàng: Sepia-Đỏ táo trầm","Phân loại hàng: Sepia-Đỏ táo trầm","Son Kem 3CE Cho Viền Môi Mờ Ảo Không Lem Blur Water Tint 4.6g"
"1773397937-252","https://shopee.vn/buyer/1363386527/rating?shop_id=1362679168","","","2026-02-08 07:25","","(GWP) 3CE Mini Square Metal Mirror Gương Vuông Kim Loại Mini 3CE | 3CE Official Store"
"1773397937-253","https://shopee.vn/buyer/1363386527/rating?shop_id=1362679168","","K biết mua phải fake ko, đánh chưa dc 1 tiếng đã trôi hết tùm lum, rồi bền màu ko lem dữ chưa. Chưa kể giao hàng quá lâu","2026-02-08 07:25 | Phân loại hàng: Sepia-Đỏ táo trầm","Phân loại hàng: Sepia-Đỏ táo trầm","Son Kem 3CE Cho Viền Môi Mờ Ảo Không Lem Blur Water Tint 4.6g"
"1773397937-254","https://shopee.vn/buyer/1363386527/rating?shop_id=1362679168","","","2026-02-07 23:51 | Phân loại hàng: #37 Raspberry Coate","Phân loại hàng: #37 Raspberry Coate","Son bóng dưỡng môi 3CE Glazy Lip Glow"
"1773397937-255","https://shopee.vn/buyer/1363386527/rating?shop_id=1362679168","","","2026-02-07 23:50 | Phân loại hàng: #34 Rose Glaze","Phân loại hàng: #34 Rose Glaze","Son bóng dưỡng môi 3CE Glazy Lip Glow"
"1773397937-256","https://shopee.vn/buyer/1363386527/rating?shop_id=1362679168","","","2026-02-07 22:35 | Phân loại hàng: Sepia-Đỏ táo trầm","Phân loại hàng: Sepia-Đỏ táo trầm","Son Kem 3CE Cho Viền Môi Mờ Ảo Không Lem Blur Water Tint 4.6g"
"1773397937-257","https://shopee.vn/buyer/1363386527/rating?shop_id=1362679168","","Đó giờ t xài màu taupe là tone đỏ nâu cam mà bản này đánh lên hồng tím, thất vọng vô cùng, ib cho shop thì kêu tuỳ nền môi? tuỳ tới mức cái màu taupe nó ra thành màu hồng tím? t xài màu taupe bản cũ nhiều rồi rất hợp còn bản này bị vậy.","2026-02-07 21:10 | Phân loại hàng: 10 - Quiet Taupe","Phân loại hàng: 10 - Quiet Taupe","Son Pha Lê 3CE Misty Lip Bare"
"1773397937-258","https://shopee.vn/buyer/1363386527/rating?shop_id=1362679168","","Xin phép chia sẻ chút ban đầu mua tưởng hàng giả luôn ko ấy, made in china mà rõ ràng mình của trong live c hannah nên cũng tin tưởng, không rõ có phải hàng chuẩn ko mà mua ở shop mall luôn ạ, mong shop có thể phản hồi lại fb này của mình ạ🙏","2026-02-25 12:11 | Phân loại hàng: Mono Pink-Hồng khô","Phân loại hàng: Mono Pink-Hồng khô","Phấn Má Hồng Mịn Lì 3CE Face Blush"
"1773397937-259","https://shopee.vn/buyer/1363386527/rating?shop_id=1362679168","","","2026-02-07 20:46 | Phân loại hàng: #01 Speak Up","Phân loại hàng: #01 Speak Up","Son Kem Lì Nhung Mịn 3CE Velvet Lip Tint Plush"
"1773397937-260","https://shopee.vn/buyer/1363386527/rating?shop_id=1362679168","","","2026-02-07 20:36","","(GWP) 3CE Mini Square Metal Mirror Gương Vuông Kim Loại Mini 3CE | 3CE Official Store"
"1773397937-261","https://shopee.vn/buyer/1363386527/rating?shop_id=1362679168","","chưa xài mà mở ra bị v rồi nè. ghéc ghê","2026-02-07 20:21 | Phân loại hàng: Slick","Phân loại hàng: Slick","Phấn Má Hồng Bắt Sáng 3CE Blushlighter"
"1773397937-262","https://shopee.vn/buyer/1363386527/rating?shop_id=1362679168","","K có quà tặng như live Hana nói","2026-02-07 17:56 | Phân loại hàng: Mono Pink-Hồng khô","Phân loại hàng: Mono Pink-Hồng khô","Phấn Má Hồng Mịn Lì 3CE Face Blush"
"1773397937-263","https://shopee.vn/buyer/1363386527/rating?shop_id=1362679168","","Sản phẩm giao đến mình trong tình trạng không con seal, chất son và màu son cùng khác với mô tả. Liên hệ đổi trả thì người bán nói sản phẩm đã bóc seal nên không hỗ trợ đổi trả…","2026-02-07 15:12 | Phân loại hàng: Midnight Call","Phân loại hàng: Midnight Call","Son Kem 3CE Cho Viền Môi Mờ Ảo Không Lem Blur Water Tint 4.6g"
"1773397937-264","https://shopee.vn/buyer/1363386527/rating?shop_id=1362679168","","Màu son ko đẹp, ko như mô tả, màu nhạt, lên màu ko chuẩn","2026-02-07 12:06 | Phân loại hàng: 06 - Tulip Fuzz","Phân loại hàng: 06 - Tulip Fuzz","Son Pha Lê 3CE Misty Lip Bare"
"1773397937-265","https://shopee.vn/buyer/1363386527/rating?shop_id=1362679168","","","2026-02-06 22:10","","Chai Xịt Cố Định Lớp Trang Điểm 3CE 3CE Shimmer Makeup Fixer"
"1773397937-266","https://shopee.vn/buyer/1363386527/rating?shop_id=1362679168","","","2026-02-06 22:10 | Phân loại hàng: 05 - Coral Drench","Phân loại hàng: 05 - Coral Drench","Son Pha Lê 3CE Misty Lip Bare"
"1773397937-267","https://shopee.vn/buyer/1363386527/rating?shop_id=1362679168","","Không đáng bỏ ra 300k","2026-02-06 22:07 | Phân loại hàng: #02 Taupe","Phân loại hàng: #02 Taupe","Son Kem Lì Nhung Mịn 3CE Velvet Lip Tint Plush"
"1773397937-268","https://shopee.vn/buyer/1363386527/rating?shop_id=1362679168","","","2026-02-06 21:50 | Phân loại hàng: COZY WHISPER-Hồng hạ","Phân loại hàng: COZY WHISPER-Hồng hạ","Son len mịn lì nịnh môi 3CE Cashmere Hug Lipstick"
"1773397937-269","https://shopee.vn/buyer/1363386527/rating?shop_id=1362679168","","Mua tặng mẹ mà mới mở ra đã gãy như này rồi đây","2026-02-06 20:54 | Phân loại hàng: 10-Already Booke","Phân loại hàng: 10-Already Booke","Son Sáp Màu Mịn Lì 3CE Sketch Stick"
"1773397937-270","https://shopee.vn/buyer/1363386527/rating?shop_id=1362679168","","Khong quay laij mua","2026-02-06 20:23 | Phân loại hàng: Lazy Talk","Phân loại hàng: Lazy Talk","Phấn Má Hồng Bắt Sáng 3CE Blushlighter"
"1773397937-271","https://shopee.vn/buyer/1363386527/rating?shop_id=1362679168","","","2026-02-06 19:29","","(GWP) Gương Pha Lê 3CE"
"1773397937-272","https://shopee.vn/buyer/1363386527/rating?shop_id=1362679168","","Eo, gương này bất tiện lắm, rút ra thì dễ chứ cất vào khó kinh.","2026-02-06 16:50","","(GWP) 3CE Mini Square Metal Mirror Gương Vuông Kim Loại Mini 3CE | 3CE Official Store"
"1773397937-273","https://shopee.vn/buyer/1363386527/rating?shop_id=1362679168","","","2026-02-06 13:11 | Phân loại hàng: Sepia-Đỏ táo trầm","Phân loại hàng: Sepia-Đỏ táo trầm","Son Kem 3CE Cho Viền Môi Mờ Ảo Không Lem Blur Water Tint 4.6g"
"1773397937-274","https://shopee.vn/buyer/1363386527/rating?shop_id=1362679168","","","2026-02-06 13:11 | Phân loại hàng: 05-High Standard","Phân loại hàng: 05-High Standard","Son Sáp Màu Mịn Lì 3CE Sketch Stick"
"1773397937-275","https://shopee.vn/buyer/1363386527/rating?shop_id=1362679168","","","2026-02-06 12:55","","(GWP) Túi Mini Đựng Son 3CE Lipstick Holder"
"1773397937-276","https://shopee.vn/buyer/1363386527/rating?shop_id=1362679168","","","2026-02-06 12:55 | Phân loại hàng: Trung Tính - N02","Phân loại hàng: Trung Tính - N02","Phấn Nước Trang Điểm 3CE Fitting Mesh Cushion"
"1773397937-277","https://shopee.vn/buyer/1363386527/rating?shop_id=1362679168","","Thiếu quà tặng","2026-02-06 11:36","","(GWP) Gương Pha Lê 3CE"
"1773397937-278","https://shopee.vn/buyer/1363386527/rating?shop_id=1362679168","","Thiếu quà tặng","2026-02-06 11:36 | Phân loại hàng: #03 Daffodil","Phân loại hàng: #03 Daffodil","Son Kem Lì Nhung Mịn 3CE Velvet Lip Tint Plush"
"1773397937-279","https://shopee.vn/buyer/1363386527/rating?shop_id=1362679168","","Thiếu quà tặng","2026-02-06 11:36 | Phân loại hàng: Going Right-Cam đào","Phân loại hàng: Going Right-Cam đào","Son kem lì nhung mịn 3CE Velvet Lip Tint"
"1773397937-280","https://shopee.vn/buyer/1363386527/rating?shop_id=1362679168","","Thiếu quà tặng","2026-02-06 11:36 | Phân loại hàng: SOFTEST-Hồng baby","Phân loại hàng: SOFTEST-Hồng baby","Son bóng dưỡng môi bắt sáng 3CE Shine Reflector (Son vặn 1 chiều)"
"1773397937-281","https://shopee.vn/buyer/1363386527/rating?shop_id=1362679168","","Quá tệ. Không cho hoàn hàng cũng không gửi lại hàng cho người mua","2026-02-06 11:01 | Phân loại hàng: Play Off-Đỏ cam","Phân loại hàng: Play Off-Đỏ cam","Son Kem 3CE Cho Viền Môi Mờ Ảo Không Lem Blur Water Tint 4.6g"
"1773397937-282","https://shopee.vn/buyer/1363386527/rating?shop_id=1362679168","","Dịch vụ chăm sóc khách hàng ko ok","2026-02-06 12:00 | Phân loại hàng: (Lõi Refill)-N02","Phân loại hàng: (Lõi Refill)-N02","Phấn Nước Trang Điểm 3CE Fitting Mesh Cushion"
"1773397937-283","https://shopee.vn/buyer/1363386527/rating?shop_id=1362679168","","Đã mua 3 thỏi dòng này, không thỏi nào có seal ở thỏi son nhưng khi hoàn hàng shop lại không đồng ý với lý do không còn seal, k còn nguyên vẹn. Sản xuất ra mà k biết à, hay cố tình lươn lẹo, k bực vì k hoàn dc, bực vì bị vu khống đã bóc hàng trong khi vỏ giấy thì dán cả 2 đầu ai bóc được. Mall mà dơ 🙂","2026-02-06 07:47 | Phân loại hàng: 10 - Quiet Taupe","Phân loại hàng: 10 - Quiet Taupe","Son Pha Lê 3CE Misty Lip Bare"
"1773397937-284","https://shopee.vn/buyer/1363386527/rating?shop_id=1362679168","","Đã mua 3 thỏi dòng này, không thỏi nào có seal ở thỏi son nhưng khi hoàn hàng shop lại không đồng ý với lý do không còn seal, k còn nguyên vẹn. Sản xuất ra mà k biết à, hay cố tình lươn lẹo, k bực vì k hoàn dc, bực vì bị vu khống đã bóc hàng trong khi vỏ giấy thì dán cả 2 đầu ai bóc được. Mall mà dơ 🙂","2026-02-06 07:47","","(GWP) Túi Mini Đựng Son 3CE Lipstick Holder"
"1773397937-285","https://shopee.vn/buyer/1363386527/rating?shop_id=1362679168","","7 vọng","2026-02-06 00:29 | Phân loại hàng: NECTAR-Nâu rượu","Phân loại hàng: NECTAR-Nâu rượu","Son bóng dưỡng môi bắt sáng 3CE Shine Reflector (Son vặn 1 chiều)"
"1773397937-286","https://shopee.vn/buyer/1363386527/rating?shop_id=1362679168","","","2026-02-05 23:30","","(GWP) Túi Mini Đựng Son 3CE Lipstick Holder"
"1773397937-287","https://shopee.vn/buyer/1363386527/rating?shop_id=1362679168","","","2026-02-05 17:30 | Phân loại hàng: SOFTEST-Hồng baby","Phân loại hàng: SOFTEST-Hồng baby","Son bóng dưỡng môi bắt sáng 3CE Shine Reflector (Son vặn 1 chiều)"
"1773397937-288","https://shopee.vn/buyer/1363386527/rating?shop_id=1362679168","","","2026-02-05 15:27 | Phân loại hàng: 11 - Rose Sigh","Phân loại hàng: 11 - Rose Sigh","Son Pha Lê 3CE Misty Lip Bare"
"1773397937-289","https://shopee.vn/buyer/1363386527/rating?shop_id=1362679168","","","2026-02-05 14:54 | Phân loại hàng: Double Wind-Hồng khô","Phân loại hàng: Double Wind-Hồng khô","Son Kem 3CE Cho Viền Môi Mờ Ảo Không Lem Blur Water Tint 4.6g"
"1773397937-290","https://shopee.vn/buyer/1363386527/rating?shop_id=1362679168","","Hàng chính hãng, cầm nặng tay
Nhưng màu son nhận dc k liên quan tới màu hãng quảng cáo
Quá buồn vì màu k giống 1 tẹo nào","2026-02-05 13:18 | Phân loại hàng: TEXT ME-Hồng mận","Phân loại hàng: TEXT ME-Hồng mận","Son len mịn lì nịnh môi 3CE Cashmere Hug Lipstick"
"1773397937-291","https://shopee.vn/buyer/1363386527/rating?shop_id=1362679168","","","2026-02-05 12:54 | Phân loại hàng: Casual Affair-Hồng","Phân loại hàng: Casual Affair-Hồng","Son Kem 3CE Cho Viền Môi Mờ Ảo Không Lem Blur Water Tint 4.6g"
"1773397937-292","https://shopee.vn/buyer/1363386527/rating?shop_id=1362679168","","Hào hứng bao nhiêu nhận về thất zọng bấy nhiêu, có phải hàng rẻ đâu mà shop ship cho mình hàng sài rồi, mở cái gương ra siêu thất vọng , cực bẩn chắc chắn đã qua sd","2026-02-05 12:40","","(GWP) Gương Pha Lê 3CE"
"1773397937-293","https://shopee.vn/buyer/1363386527/rating?shop_id=1362679168","","Hào hứng bao nhiêu nhận về thất zọng bấy nhiêu, có phải hàng rẻ đâu mà shop ship cho mình hàng sài rồi, mở cái gương ra siêu thất vọng , cực bẩn chắc chắn đã qua sd","2026-02-05 12:40 | Phân loại hàng: Bake Beige-Nâu cam","Phân loại hàng: Bake Beige-Nâu cam","Son Kem 3CE Cho Viền Môi Mờ Ảo Không Lem Blur Water Tint 4.6g"
"1773397937-294","https://shopee.vn/buyer/1363386527/rating?shop_id=1362679168","","Cùng mua 1 mã màu , màu cũ thì mịn, màu mới khác so với màu cũ , khô ráp","2026-02-05 12:39 | Phân loại hàng: Speak Up-Lê đỏ ngâm","Phân loại hàng: Speak Up-Lê đỏ ngâm","Son kem lì nhung mịn 3CE Velvet Lip Tint"
"1773397937-295","https://shopee.vn/buyer/1363386527/rating?shop_id=1362679168","","Đóng hàng không có keo dính chắc chắn, vừa giao đến đã tự bung ra? Không đảm bảo được sản phẩm có bị đổi không","2026-02-05 12:35","","Chai Xịt Cố Định Lớp Trang Điểm 3CE 3CE Shimmer Makeup Fixer"
"1773397937-296","https://shopee.vn/buyer/1363386527/rating?shop_id=1362679168","","lúc mở ra là hàng đã như này rồi ấy ? sao shop unbox hàng còn ko thèm đóng lại xong đi ship cho khách là sao?? làm ăn bất lương vậy trời, mở ra thì bụi bẩn vướng trên lọ như kiểu đưa ra lâu ngày xong đến lúc gửi cho khách mới bỏ vào hộp ấy?","2026-02-05 09:47","","Chai Xịt Cố Định Lớp Trang Điểm 3CE 3CE Shimmer Makeup Fixer"
"1773397937-297","https://shopee.vn/buyer/1363386527/rating?shop_id=1362679168","","","2026-02-05 01:57","","(GWP) Son Kem Mịn Mờ Môi 3CE Blur Water Tint Mini #Laydown"
"1773397937-298","https://shopee.vn/buyer/1363386527/rating?shop_id=1362679168","","","2026-02-04 23:45","","(GWP) 3CE Mini Square Metal Mirror Gương Vuông Kim Loại Mini 3CE | 3CE Official Store"
