web_scraper_order,web_scraper_start_url,pagination,comment,date,data6,data7
"1773397937-751","https://shopee.vn/buyer/1363386527/rating?shop_id=1362679168","","ko chấp nhận khiếu nại thì xin hãy gửi lại hàng, hàng mất tiêu luôn, tiền mất tiêu luôn. xứng đáng 1 sao","2025-12-16 14:17 | Phân loại hàng: Casual Affair-Hồng","Phân loại hàng: Casual Affair-Hồng","Son Kem 3CE Cho Viền Môi Mờ Ảo Không Lem Blur Water Tint"
"1773397937-752","https://shopee.vn/buyer/1363386527/rating?shop_id=1362679168","","Son không lì nhé mấy chị em. Uống nước thôi cũng đã trôi rồi, còn ăn thì bay sạch
Đánh lên như mủ mít dính trên môi vậy á
Màu son không giống màu của ảnh minh hoạ đâu","2025-12-25 12:28 | Phân loại hàng: Sepia-Đỏ táo trầm","Phân loại hàng: Sepia-Đỏ táo trầm","Son Kem 3CE Cho Viền Môi Mờ Ảo Không Lem Blur Water Tint"
"1773397937-753","https://shopee.vn/buyer/1363386527/rating?shop_id=1362679168","","cx dc mà thik mat dạy","2025-12-16 14:11 | Phân loại hàng: Lazy Talk","Phân loại hàng: Lazy Talk","Phấn Má Hồng Bắt Sáng 3CE Blushlighter"
"1773397937-754","https://shopee.vn/buyer/1363386527/rating?shop_id=1362679168","","Mua nhiều sp của 3ce nhưng đến đơn này cần liên hệ với shop !! Mình thấy cskh rất tệ :(((","2025-12-16 13:49 | Phân loại hàng: (Lõi Refill)-N02","Phân loại hàng: (Lõi Refill)-N02","Phấn Nước Trang Điểm 3CE Fitting Mesh Cover Cushion"
"1773397937-755","https://shopee.vn/buyer/1363386527/rating?shop_id=1362679168","","","2025-12-16 13:19","","(GWP) Túi Mini Đựng Son 3CE Lipstick Holder"
"1773397937-756","https://shopee.vn/buyer/1363386527/rating?shop_id=1362679168","","Màu xấu , choé không đẹp . 1 điểm cho màu son này . Mấy cái review tiktok khéo là booking cả seeding cmt .","2025-12-16 12:37 | Phân loại hàng: Casual Affair-Hồng","Phân loại hàng: Casual Affair-Hồng","Son Kem 3CE Cho Viền Môi Mờ Ảo Không Lem Blur Water Tint"
"1773397937-757","https://shopee.vn/buyer/1363386527/rating?shop_id=1362679168","","","2025-12-16 12:08 | Phân loại hàng: (Lõi Refill)-W01","Phân loại hàng: (Lõi Refill)-W01","Phấn Nước Trang Điểm 3CE Fitting Mesh Cover Cushion"
"1773397937-758","https://shopee.vn/buyer/1363386527/rating?shop_id=1362679168","","Đóng gói sơ xài, sản phẩm gửi made in china, cảm thấy chất lượng ko xứng với giá tiền, sản phẩm của hàn quốc nhưng trên bao mì gửi cho khách là China","2025-12-16 11:51 | Phân loại hàng: Rose Beige-Cam đào","Phân loại hàng: Rose Beige-Cam đào","Phấn Má Hồng Mịn Lì 3CE Face Blush"
"1773397937-759","https://shopee.vn/buyer/1363386527/rating?shop_id=1362679168","","Dùng bị dị ứng thoa nhiều thấy môi khá sót lên mụn nước liti quanh viền môi son 3ce đợt này thấy vọng quá màu lên cũng k đẹp","2025-12-16 10:24 | Phân loại hàng: #36 Double Grape","Phân loại hàng: #36 Double Grape","Son bóng dưỡng môi 3CE Glazy Lip Glow"
"1773397937-760","https://shopee.vn/buyer/1363386527/rating?shop_id=1362679168","","màu không giống ảnh, khô môi. 
dùng được 2 tuần đã gãy chịu đấy ?","2025-12-16 08:41 | Phân loại hàng: 13-Silent Bloom","Phân loại hàng: 13-Silent Bloom","Son Sáp Màu Mịn Lì 3CE Sketch Stick"
"1773397937-761","https://shopee.vn/buyer/1363386527/rating?shop_id=1362679168","","","2025-12-15 22:42 | Phân loại hàng: WHIP RED-Đỏ mận","Phân loại hàng: WHIP RED-Đỏ mận","Son kem bùn mịn lì 3CE Hazy Lip Clay"
"1773397937-762","https://shopee.vn/buyer/1363386527/rating?shop_id=1362679168","","hãy cẩn thận với shop này! Họ chỉ muốn bán chứ không chịu trách nhiệm với sản phẩm của họ","2025-12-24 11:30","","(GWP) Túi Mini Đựng Son 3CE Lipstick Holder"
"1773397937-763","https://shopee.vn/buyer/1363386527/rating?shop_id=1362679168","","Mua thì được nhưng dịch vụ của người bán rất chi giả dối","2025-12-24 11:32 | Phân loại hàng: Slick","Phân loại hàng: Slick","Phấn Má Hồng Bắt Sáng 3CE Blushlighter"
"1773397937-764","https://shopee.vn/buyer/1363386527/rating?shop_id=1362679168","","Shop dịch vụ hoàn trả rất giả dối","2025-12-24 11:31","","(GWP) Son Kem Mịn Mờ Môi 3CE Blur Water Tint Mini #Laydown"
"1773397937-765","https://shopee.vn/buyer/1363386527/rating?shop_id=1362679168","","Mình sẽ không bao giờ ủng hộ shop thêm 1 lần nào nữa","2025-12-24 11:31 | Phân loại hàng: BUDDY-Hồng cá hồi","Phân loại hàng: BUDDY-Hồng cá hồi","Son len mịn lì nịnh môi 3CE Cashmere Hug Lipstick"
"1773397937-766","https://shopee.vn/buyer/1363386527/rating?shop_id=1362679168","","Đóng gói rất sơ sài, hàng tặng thì vừa dơ vừa bong keo như hàng tồn, nhắn tin hỏi thì cứ nói do sàn nên mình phải thông cảm :)","2025-12-15 19:52","","(GWP) Túi Mini Đựng Son 3CE Lipstick Holder"
"1773397937-767","https://shopee.vn/buyer/1363386527/rating?shop_id=1362679168","","Đóng gói rất sơ sài, hàng tặng thì vừa dơ vừa bong keo như hàng tồn, nhắn tin hỏi thì cứ nói do sàn nên mình phải thông cảm :)","2025-12-15 19:52 | Phân loại hàng: Taupe-Gạch đỏ","Phân loại hàng: Taupe-Gạch đỏ","Son kem lì nhung mịn 3CE Velvet Lip Tint"
"1773397937-768","https://shopee.vn/buyer/1363386527/rating?shop_id=1362679168","","Đóng gói rất sơ sài, hàng tặng thì vừa dơ vừa bong keo như hàng tồn, nhắn tin hỏi thì cứ nói do sàn nên mình phải thông cảm :)","2025-12-15 19:52 | Phân loại hàng: TAUPE BEIGE-Nâu đất","Phân loại hàng: TAUPE BEIGE-Nâu đất","Son len mịn lì nịnh môi 3CE Cashmere Hug Lipstick"
"1773397937-769","https://shopee.vn/buyer/1363386527/rating?shop_id=1362679168","","","2025-12-15 19:07 | Phân loại hàng: Play Off-Đỏ cam","Phân loại hàng: Play Off-Đỏ cam","Son Kem 3CE Cho Viền Môi Mờ Ảo Không Lem Blur Water Tint"
"1773397937-770","https://shopee.vn/buyer/1363386527/rating?shop_id=1362679168","","Nhận hàng bẹp dẹp:)) giao đóng gói kiểu gì ko biết. Cả hộp ngoài lẫn trong bẹp dí","2025-12-15 18:50","","Chai Xịt Cố Định Lớp Trang Điểm 3CE 3CE Shimmer Makeup Fixer"
"1773397937-771","https://shopee.vn/buyer/1363386527/rating?shop_id=1362679168","","bên hãng gửi sai hàng mình cũng đã liên hệ vs hãng để giải quyết nhưng hãng ko giải quyết cũng như có chính sách cho mình hoàn đơn hàng này thật sự quá thất vọng khi 1 hãng lớn làm ăn như này mà mình còn mua trên live của c Hana nữa chứ là có đang lừa đảo khách hàng hay ko ? bên shopee cũng ko hỗ trợ đổi trả hàng thật sự quá bức xúc về cách làm việc của 3ce một hãng lớn như vậy","2025-12-15 17:41 | Phân loại hàng: Chasing Rose-Hồng","Phân loại hàng: Chasing Rose-Hồng","Son Kem 3CE Cho Viền Môi Mờ Ảo Không Lem Blur Water Tint"
"1773397937-772","https://shopee.vn/buyer/1363386527/rating?shop_id=1362679168","","Thấy hàng hơi giả, niêm phong kì kì, mùi không thơm

Màu sepia này hơi đậm dừ dừ

Thất vọng quá ò huhuu
📣[HCM] TUYỂN DỤNG NHÂN VIÊN TƯ VẤN & CHĂM SÓC KHÁCH HÀNG PART TIME ✨
Cơ hội được đào tạo và rèn luyện trong môi trường làm việc chuyên nghiệp cho vị trí Nhân viên Chăm sóc Khách hàng tại Teemo Sneaker!
*Lưu ý: Địa điểm phỏng vấn tại 196A1 Trần Quang Khải, P.Tân Định, Q1. 
--------------------------
Yêu cầu công việc đối với vị trí: TƯ VẤN VÀ CHĂM SÓC KHÁCH HÀNG ONLINE
a) Mô tả công việc:
- Trả lời câu hỏi và giải đáp những thắc mắc của khách hàng qua Facebook, Zalo, Instagram…
- Chốt đơn hàng và lên đơn.
- Quản lý và chăm sóc fanpage.
- Thực hiện các công việc khác liên quan đến chăm sóc khách hàng theo yêu cầu.
b) Thu nhập & quyền lợi :
Mức lương :
- Part-","2025-12-15 16:49 | Phân loại hàng: Sepia-Đỏ táo trầm","Phân loại hàng: Sepia-Đỏ táo trầm","Son Kem 3CE Cho Viền Môi Mờ Ảo Không Lem Blur Water Tint"
"1773397937-773","https://shopee.vn/buyer/1363386527/rating?shop_id=1362679168","","KHÔNG LÌ NHA, SON RA SON MÔI RA MÔI","2025-12-15 16:16 | Phân loại hàng: BUDDY-Hồng cá hồi","Phân loại hàng: BUDDY-Hồng cá hồi","Son len mịn lì nịnh môi 3CE Cashmere Hug Lipstick"
"1773397937-774","https://shopee.vn/buyer/1363386527/rating?shop_id=1362679168","","To quá","2025-12-15 15:13","","(GWP) Túi Mini Đựng Son 3CE Lipstick Holder"
"1773397937-775","https://shopee.vn/buyer/1363386527/rating?shop_id=1362679168","","Mình thấy mn đều là made in Korea sao của mình lại made in china nhỉ","2025-12-15 12:29 | Phân loại hàng: Delectable-Hồng dâu","Phân loại hàng: Delectable-Hồng dâu","Phấn Má Hồng Mịn Lì 3CE Face Blush"
"1773397937-776","https://shopee.vn/buyer/1363386527/rating?shop_id=1362679168","","Giao hộp phấn lỗi cho mình vậy,mà mình chốt trên live stream của zk ck tuan duơng dot siêu sale 12/12","2025-12-15 11:58 | Phân loại hàng: Lazy Talk","Phân loại hàng: Lazy Talk","Phấn Má Hồng Bắt Sáng 3CE Blushlighter"
"1773397937-777","https://shopee.vn/buyer/1363386527/rating?shop_id=1362679168","","Mình mua thì thấy son thì ko dán niêm phong, má hồng thì có dán niêm phong. Mình săn live vì thấy có quà tặng kèm. Nhưng mua về thì không có.","2025-12-15 11:51 | Phân loại hàng: Beige Crush","Phân loại hàng: Beige Crush","Phấn Má Hồng 3CE Bouncy Blur Balm"
"1773397937-778","https://shopee.vn/buyer/1363386527/rating?shop_id=1362679168","","lừa đảo ghi tặng thêm quà 12/12 mà giao tới k có quà
nhãn hàng lớn mà lừa thế chịu rồi","2025-12-15 11:50 | Phân loại hàng: #01 Speak Up","Phân loại hàng: #01 Speak Up","Son Kem Lì Nhung Mịn 3CE Velvet Lip Tint Plush"
"1773397937-779","https://shopee.vn/buyer/1363386527/rating?shop_id=1362679168","","Mình mua hàng vào khung giờ săn live của chị Hana Olala. Thấy để khung giờ tặng có quà nên mua vì thích đc tặng qua đi kèm. Nhưng mua hàng về thì cả 2 món đều ko đc tặng quà. Nt cho shop thì shop đọc nhưng ko trả lời. Nên đành phải đánh giá .","2025-12-15 11:48 | Phân loại hàng: Laydown-Hồng trầm","Phân loại hàng: Laydown-Hồng trầm","Son Kem 3CE Cho Viền Môi Mờ Ảo Không Lem Blur Water Tint"
"1773397937-780","https://shopee.vn/buyer/1363386527/rating?shop_id=1362679168","","Hàng made in China.","2025-12-15 11:12 | Phân loại hàng: City Mauve-Hồng khói","Phân loại hàng: City Mauve-Hồng khói","Phấn Má Hồng Mịn Lì 3CE Face Blush"
"1773397937-781","https://shopee.vn/buyer/1363386527/rating?shop_id=1362679168","","","2025-12-15 10:51 | Phân loại hàng: Bitter Hour-Đỏ đất","Phân loại hàng: Bitter Hour-Đỏ đất","Son kem lì nhung mịn 3CE Velvet Lip Tint"
"1773397937-782","https://shopee.vn/buyer/1363386527/rating?shop_id=1362679168","","Màu son khác hẳn so với hình ảnh
Màu như màu đất sét","2025-12-14 15:19 | Phân loại hàng: Bitter Hour-Đỏ đất","Phân loại hàng: Bitter Hour-Đỏ đất","Son kem lì nhung mịn 3CE Velvet Lip Tint"
"1773397937-783","https://shopee.vn/buyer/1363386527/rating?shop_id=1362679168","","màu xấu 
bị ngả tím sau khi đánh dc 2p
môi kh thâm","2025-12-14 15:15 | Phân loại hàng: Sepia-Đỏ táo trầm","Phân loại hàng: Sepia-Đỏ táo trầm","Son Kem 3CE Cho Viền Môi Mờ Ảo Không Lem Blur Water Tint"
"1773397937-784","https://shopee.vn/buyer/1363386527/rating?shop_id=1362679168","","Nghi ngờ hàng giả
Nhưng thiết kế và chất lượng tệ nha. Son tự gãy do sáp son ko có độ kết 
Ko ủng hộ","2025-12-14 13:44 | Phân loại hàng: 02-Unfolding Ros","Phân loại hàng: 02-Unfolding Ros","Son Sáp Màu Mịn Lì 3CE Sketch Stick"
"1773397937-785","https://shopee.vn/buyer/1363386527/rating?shop_id=1362679168","","","2025-12-14 12:31 | Phân loại hàng: Play Off-Đỏ cam","Phân loại hàng: Play Off-Đỏ cam","Son Kem 3CE Cho Viền Môi Mờ Ảo Không Lem Blur Water Tint"
"1773397937-786","https://shopee.vn/buyer/1363386527/rating?shop_id=1362679168","","Nói chung là khá ba chấm với đồ tặng, thôi thì mình nghỉ bên shop bán thôi đừng tặng nữa nó giảm giá trị sản phẩm ạ","2025-12-13 23:19","","(GWP) Túi Mini Đựng Son 3CE Lipstick Holder"
"1773397937-787","https://shopee.vn/buyer/1363386527/rating?shop_id=1362679168","","Nhận hàng đc 3 tiếng, quẹt 1 lần rồi đóng nắp cẩn thận, giờ mang ra quẹt lần 2 thì thấy gãy vậy rồi. Mua đủ loại của 3CE mà dòng này quá là chán luôn.","2025-12-13 21:19 | Phân loại hàng: 05-High Standard","Phân loại hàng: 05-High Standard","Son Sáp Màu Mịn Lì 3CE Sketch Stick"
"1773397937-788","https://shopee.vn/buyer/1363386527/rating?shop_id=1362679168","","Sao mình test ở ngoài mall chất lượng khác 1 trời một vực với mua của hãng trên shopee vậy???
Của Hàn mà giờ để lun là Made in China là không ưng rồi đó. Chất son cũng khác hoàn toàn với cây chính hãng mình thử qua ở Aeon luôn
Test lên môi màu ko rõ đẹp như ngoài Aeon, Tệ thật sự, đã vậy săn sale 12-12 mà ko lấy một quà tặng 😏😏😏😏
Lần đầu mua son xịn vậy mà chất lượng thật khiến mình thất vọng , biết vậy trả hàng mà lỡ bấm rồi","2025-12-13 20:24 | Phân loại hàng: Coral Moon-Cam gạch","Phân loại hàng: Coral Moon-Cam gạch","Son Kem 3CE Cho Viền Môi Mờ Ảo Không Lem Blur Water Tint"
"1773397937-789","https://shopee.vn/buyer/1363386527/rating?shop_id=1362679168","","K hài lòng","2025-12-13 17:36 | Phân loại hàng: HUSH RED-Đỏ mâm xôi","Phân loại hàng: HUSH RED-Đỏ mâm xôi","Son len mịn lì nịnh môi 3CE Cashmere Hug Lipstick"
"1773397937-790","https://shopee.vn/buyer/1363386527/rating?shop_id=1362679168","","Pas má hồng mono pink vừa nhận ạ, màu đánh k hợp. 
Zalo 0842203002 150k","2025-12-13 17:26 | Phân loại hàng: Mono Pink-Hồng khô","Phân loại hàng: Mono Pink-Hồng khô","Phấn Má Hồng Mịn Lì 3CE Face Blush"
"1773397937-791","https://shopee.vn/buyer/1363386527/rating?shop_id=1362679168","","trong giỏ hàng mua 1 cây là được tặng thêm 1 cây son, tui mua 2 cây, nhắn cho shop không lấy son mà lấy móc khoá theo 3 sự lựa chọn. shop giao không có móc khoá, ít ra cũng tặng lại khách 2 cây son kèm theo đơn hàng như quãng cáo quy định ban đầu chứ.","2025-12-13 14:33 | Phân loại hàng: #32 Peachy Filling, #30 Melting Smore","Phân loại hàng: #32 Peachy Filling","Son bóng dưỡng môi 3CE Glazy Lip Glow"
"1773397937-792","https://shopee.vn/buyer/1363386527/rating?shop_id=1362679168","","hình ảnh minh hoạ, nhưng đóng gói rất ẩu vô cùng ẩu rất rất ẩu. Son bên trong chưa boc seal nên tạm chấp nhận. Nhưng vỏ bên ngoài bị bóc rồi. Nói chung kém.","2025-12-12 22:55 | Phân loại hàng: Sepia-Đỏ táo trầm","Phân loại hàng: Sepia-Đỏ táo trầm","Son Kem 3CE Cho Viền Môi Mờ Ảo Không Lem Blur Water Tint"
"1773397937-793","https://shopee.vn/buyer/1363386527/rating?shop_id=1362679168","","Màu hồng cánh sen ạ. Thất vọng cực kỳ. Mua phí tiền mà ko dùng được","2025-12-12 21:45 | Phân loại hàng: Spot Player-Táo đỏ","Phân loại hàng: Spot Player-Táo đỏ","Son Kem 3CE Cho Viền Môi Mờ Ảo Không Lem Blur Water Tint"
"1773397937-794","https://shopee.vn/buyer/1363386527/rating?shop_id=1362679168","","Hàng tặng mà bị hỏng nút","2025-12-12 18:39","","(GWP) Túi Mini Đựng Son 3CE Lipstick Holder"
"1773397937-795","https://shopee.vn/buyer/1363386527/rating?shop_id=1362679168","","","2025-12-12 09:45 | Phân loại hàng: Laydown-Hồng trầm","Phân loại hàng: Laydown-Hồng trầm","Son Kem 3CE Cho Viền Môi Mờ Ảo Không Lem Blur Water Tint"
"1773397937-796","https://shopee.vn/buyer/1363386527/rating?shop_id=1362679168","","Màu son xỉn không như quảng cáo, chất liệu cũng không mướt.","2025-12-12 09:03 | Phân loại hàng: Early Hour-Hồng ngọt","Phân loại hàng: Early Hour-Hồng ngọt","Son Kem 3CE Cho Viền Môi Mờ Ảo Không Lem Blur Water Tint"
"1773397937-797","https://shopee.vn/buyer/1363386527/rating?shop_id=1362679168","","s k bt I am so sorry for your inconvenience this morning I have a meeting on Friday and Friday at noon 🕛 so I’ll let you go in and out for the day before","2025-12-12 01:22","","Chai Xịt Cố Định Lớp Trang Điểm 3CE 3CE Shimmer Makeup Fixer"
"1773397937-798","https://shopee.vn/buyer/1363386527/rating?shop_id=1362679168","","Sp không như mô tả. Son lên k đều màu. K phải lần đầu mình mua 3ce. Những làn trước đều oki còn lần này vô cùng xấu. Trả hàng thì shop không cho.","2025-12-11 16:26 | Phân loại hàng: Play Off-Đỏ cam","Phân loại hàng: Play Off-Đỏ cam","Son Kem 3CE Cho Viền Môi Mờ Ảo Không Lem Blur Water Tint"
"1773397937-799","https://shopee.vn/buyer/1363386527/rating?shop_id=1362679168","","Sản phẩm son không lì, bóng, đánh không thích","2025-12-11 16:00 | Phân loại hàng: Pink Guava-Hồng đào","Phân loại hàng: Pink Guava-Hồng đào","Son Kem 3CE Cho Viền Môi Mờ Ảo Không Lem Blur Water Tint"
"1773397937-800","https://shopee.vn/buyer/1363386527/rating?shop_id=1362679168","","bụi lên màu kém không thần thánh như quảng cáo","2025-12-11 01:02 | Phân loại hàng: Mono Pink-Hồng khô","Phân loại hàng: Mono Pink-Hồng khô","Phấn Má Hồng Mịn Lì 3CE Face Blush"
"1773397937-801","https://shopee.vn/buyer/1363386527/rating?shop_id=1362679168","","Màu ko đúng mô tả","2025-12-10 21:06 | Phân loại hàng: Play Off-Đỏ cam","Phân loại hàng: Play Off-Đỏ cam","Son Kem 3CE Cho Viền Môi Mờ Ảo Không Lem Blur Water Tint"
"1773397937-802","https://shopee.vn/buyer/1363386527/rating?shop_id=1362679168","","M dùng son cũng nhiều năm mà lần đầu gặp chất lượng kém ntn, chất son xấu, dùng rất lộ viền môi và màu son lạc quẻ trên môi kiểu khó bám nhanh trôi trong khi m đã tẩy tb chết và dùng dưỡng môi. Thử Thay bằng dòng son khác thì thấy lên môi bình thường, quay lại son này để test lại
 thì thêm bực mình, không xứng đáng với giá tiền này. Các b nên ra cửa hàng test trực tiếp thì tốt hơn.","2025-12-10 17:01 | Phân loại hàng: BUDDY-Hồng cá hồi","Phân loại hàng: BUDDY-Hồng cá hồi","Son len mịn lì nịnh môi 3CE Cashmere Hug Lipstick"
"1773397937-803","https://shopee.vn/buyer/1363386527/rating?shop_id=1362679168","","","2025-12-10 12:18","","(GWP) Túi Đựng Phấn Nước Mini 3CE Fitting Mesh Cover Cushion Pouch"
"1773397937-804","https://shopee.vn/buyer/1363386527/rating?shop_id=1362679168","","ngồi nghe tư vấn cả buổi, mình mua nhiều sp 3ce rồi, tin tưởng nên cũng chốt, đã hỏi đi hỏi lại trên live để tư vấn rồi, về nhà kiểu gì vàng khè, ý là trên live tư vấn cũng không đúng 100% dc, nhưng có vấn đề thì đây một phần cũng là lỗi ng bán chứ, mình mua cả lõi cả hộp, mới khui hộp th, trả hàng kh dc, lõi không nhận. Bên tư vấn thì m hỏi cách giải quyết cũng không trả lời đúng trọng tâm, ý như kiểu kêu mình xài đỡ đi tại shoppee kh giải quyết, mà đối với mình sản phẩm mắc hơn thị trường, hãng lớn mà làm ăn vậy đó, cũng không có cách giải quyết gì cho quyền lợi khách hàng. Chịu thật","2025-12-10 12:18 | Phân loại hàng: Trung Tính - N01","Phân loại hàng: Trung Tính - N01","3CE Combo Phấn Nước Fitting Mesh Cover Cushion Kèm Lõi Refill"
"1773397937-805","https://shopee.vn/buyer/1363386527/rating?shop_id=1362679168","","Mình đã xem trước các review phải vặn rất ít nhưng mà son mới dùng có 2,3 lần đã gãy?","2025-12-10 07:16 | Phân loại hàng: 13-Silent Bloom","Phân loại hàng: 13-Silent Bloom","Son Sáp Màu Mịn Lì 3CE Sketch Stick"
"1773397937-806","https://shopee.vn/buyer/1363386527/rating?shop_id=1362679168","","Son cực kỳ dỏm 
Son lên môi vón cục kinh
Mua hơn 3 trăm mà như hàng chợ
Sẽ k quay lại","2025-12-09 18:14 | Phân loại hàng: OAT-Be yến mạch","Phân loại hàng: OAT-Be yến mạch","Son len mịn lì nịnh môi 3CE Cashmere Hug Lipstick"
"1773397937-807","https://shopee.vn/buyer/1363386527/rating?shop_id=1362679168","","Nút vặn lên được nhưng vặn xuống bị lỗi k vặn xuống được! Chất son hơi the the kiểu bạc hà cảm giác tê môi khoảng 10s sau khi son. Màu lên k nhiều giống như miêu tả 🙂‍↕️","2025-12-09 13:24 | Phân loại hàng: SOFTEST-Hồng baby","Phân loại hàng: SOFTEST-Hồng baby","Son bóng dưỡng môi bắt sáng 3CE Shine Reflector (Son vặn 1 chiều)"
"1773397937-808","https://shopee.vn/buyer/1363386527/rating?shop_id=1362679168","","","2025-12-09 10:57 | Phân loại hàng: #37 Raspberry Coate","Phân loại hàng: #37 Raspberry Coate","Son bóng dưỡng môi 3CE Glazy Lip Glow"
"1773397937-809","https://shopee.vn/buyer/1363386527/rating?shop_id=1362679168","","","2025-12-09 09:45 | Phân loại hàng: Play Off-Đỏ cam","Phân loại hàng: Play Off-Đỏ cam","Son Kem 3CE Cho Viền Môi Mờ Ảo Không Lem Blur Water Tint"
"1773397937-810","https://shopee.vn/buyer/1363386527/rating?shop_id=1362679168","","Mình đặt 1 cây son kem và 1 cây son dưỡng, nhận về ko còn nhu cầu sử dụng nữa nên mình bấm trả hàng. Các shop hay thông báo là lúc trả hàng vấn đề gì cũng để lí do ko còn nhu cầu sử dụng để shop khỏi bị điểm xấu đúng ko? Nhưng ko, shop này ko cho trả hàng với lý do phải có hộp carton hoặc bì nhựa như ban đầu, lý do rất vớ vẩn, mình đâu có nghĩ là sẽ mua và trả hàng nên mình k giữ lại hộp như ban đầu, mình gói vào bì nhựa và trả hàng. Shop ko đồng ý và hoàn lại cho mình, chỉ hoàn lại cây son chứ mất luôn cây son dưỡng🙂 nhắn tin xin video gói hàng của shop thì shop nói nhắn với shopee. Lần đầu mua 1 đơn hàng mà cảm thấy khó chịu như vậy luôn. Xin phép thêm vô blacklist.","2025-12-08 17:42","","(GWP) Túi Mini Đựng Son 3CE Lipstick Holder"
"1773397937-811","https://shopee.vn/buyer/1363386527/rating?shop_id=1362679168","","Mình đặt 1 cây son kem và 1 cây son dưỡng, nhận về ko còn nhu cầu sử dụng nữa nên mình bấm trả hàng. Các shop hay thông báo là lúc trả hàng vấn đề gì cũng để lí do ko còn nhu cầu sử dụng để shop khỏi bị điểm xấu đúng ko? Nhưng ko, shop này ko cho trả hàng với lý do phải có hộp carton hoặc bì nhựa như ban đầu, lý do rất vớ vẩn, mình đâu có nghĩ là sẽ mua và trả hàng nên mình k giữ lại hộp như ban đầu, mình gói vào bì nhựa và trả hàng. Shop ko đồng ý và hoàn lại cho mình, chỉ hoàn lại cây son chứ mất luôn cây son dưỡng🙂 nhắn tin xin video gói hàng của shop thì shop nói nhắn với shopee. Lần đầu mua 1 đơn hàng mà cảm thấy khó chịu như vậy luôn. Xin phép thêm vô blacklist.","2025-12-08 17:41 | Phân loại hàng: #24 Molten Coppe","Phân loại hàng: #24 Molten Coppe","Son Kem Lì Nhung Mịn 3CE Velvet Lip Tint Plush"
"1773397937-812","https://shopee.vn/buyer/1363386527/rating?shop_id=1362679168","","Mình đặt 1 cây son kem và 1 cây son dưỡng, nhận về ko còn nhu cầu sử dụng nữa nên mình bấm trả hàng. Các shop hay thông báo là lúc trả hàng vấn đề gì cũng để lí do ko còn nhu cầu sử dụng để shop khỏi bị điểm xấu đúng ko? Nhưng ko, shop này ko cho trả hàng với lý do phải có hộp carton hoặc bì nhựa như ban đầu, lý do rất vớ vẩn, mình đâu có nghĩ là sẽ mua và trả hàng nên mình k giữ lại hộp như ban đầu, mình gói vào bì nhựa và trả hàng. Shop ko đồng ý và hoàn lại cho mình, chỉ hoàn lại cây son chứ mất luôn cây son dưỡng🙂 nhắn tin xin video gói hàng của shop thì shop nói nhắn với shopee. Lần đầu mua 1 đơn hàng mà cảm thấy khó chịu như vậy luôn. Xin phép thêm vô blacklist.","2025-12-08 17:41 | Phân loại hàng: #33 Cool Sweetie","Phân loại hàng: #33 Cool Sweetie","Son bóng dưỡng môi 3CE Glazy Lip Glow"
"1773397937-813","https://shopee.vn/buyer/1363386527/rating?shop_id=1362679168","","","2025-12-08 17:24","","(GWP) Túi Mini Đựng Son 3CE Lipstick Holder"
