web_scraper_order,web_scraper_start_url,pagination,comment,date,data6,data7
"1773397937-448","https://shopee.vn/buyer/1363386527/rating?shop_id=1362679168","","","2026-01-20 12:03 | Phân loại hàng: Mono Pink-Hồng khô","Phân loại hàng: Mono Pink-Hồng khô","Phấn Má Hồng Mịn Lì 3CE Face Blush"
"1773397937-449","https://shopee.vn/buyer/1363386527/rating?shop_id=1362679168","","Thông tin sản phẩm là đỏ cam nhưng hàng thực tế lại hồng, shop giải thích là hồng, và biết rõ là tt sai mà vẫn cố tình để vậy để người mua hiểu nhầm, quá tệ, lần đầu tiên mua hàng thấy bức xúc như vậy và để lại đánh giá 😡","2026-01-20 08:46 | Phân loại hàng: Play Off-Đỏ cam","Phân loại hàng: Play Off-Đỏ cam","Son Kem 3CE Cho Viền Môi Mờ Ảo Không Lem Blur Water Tint 4.6g"
"1773397937-450","https://shopee.vn/buyer/1363386527/rating?shop_id=1362679168","","Trả hàng kh đc hoàn hàng lâu hơn 15 ngày","2026-01-20 06:35 | Phân loại hàng: Sepia-Đỏ táo trầ","Phân loại hàng: Sepia-Đỏ táo trầ","Son Kem 3CE Cho Viền Môi Mờ Ảo Không Lem Blur Water Tint 4.6g"
"1773397937-451","https://shopee.vn/buyer/1363386527/rating?shop_id=1362679168","","","2026-01-20 05:11","","(GWP) Son Kem Mịn Mờ Môi 3CE Blur Water Tint Mini #Laydown"
"1773397937-452","https://shopee.vn/buyer/1363386527/rating?shop_id=1362679168","","Dịch vụ của shop rất tệ
Khi mua hàng ghi rõ là có quà tặng kèm theo và không có ghi là giới hạn nhưng khi nhận hàng không có , nhắn báo thiếu thì shop nói do lúc mua hết, trong khi trên bài bán sản phẩm hiện tại vẫn ghi có quà tặng
Chán thật sự","2026-01-20 01:40","","Chai Xịt Cố Định Lớp Trang Điểm 3CE 3CE Shimmer Makeup Fixer"
"1773397937-453","https://shopee.vn/buyer/1363386527/rating?shop_id=1362679168","","k có hàng tặng,","2026-01-24 15:20","","(GWP) Son Len Mịn Lì 3CE Cashmere Hug Mini #Cozy Whisper"
"1773397937-454","https://shopee.vn/buyer/1363386527/rating?shop_id=1362679168","","Hãng của Hàn nhưng lại là made in china ?","2026-01-19 19:56 | Phân loại hàng: Sepia-Đỏ táo trầm","Phân loại hàng: Sepia-Đỏ táo trầm","Son Kem 3CE Cho Viền Môi Mờ Ảo Không Lem Blur Water Tint 4.6g"
"1773397937-455","https://shopee.vn/buyer/1363386527/rating?shop_id=1362679168","","Mình mua hộp kem gồm 1 cushion + 1 lõi, kèm quà tặng nhỏ.
Sau khi đặt hàng mình phát hiện chọn nhầm màu nhưng không huỷ được, nên khi hàng về mình không mở kiểm và bấm trả hàng ngay, giao nguyên hộp shop gửi cho shipper.

Tuy nhiên shop phản hồi rằng mỹ phẩm bị tác động, hộp bị méo và từ chối hoàn tiền, dù mình chưa hề mở hay sử dụng sản phẩm. Mình đã chấp nhận nhận lại hàng và chịu mất tiền để kết thúc vấn đề.

Nhưng điều không thể chấp nhận là sau 18 ngày kể từ khi shop thông báo gửi trả, mình mới nhận được hàng. Đóng gói rất sơ sài, gần như không bảo vệ sản phẩm. Khi mở ra thì THIẾU MẤT LÕI cushion, chỉ còn cushion và quà tặng nhỏ.

Trải nghiệm mua sắm rất tệ: xử lý thiếu thiện chí, giao hàng chậm, gửi thiếu sản phẩm. Mọi người nên cân nhắc kỹ trước khi mua.","2026-02-07 16:50 | Phân loại hàng: COZY WHISPER-Hồng hạ","Phân loại hàng: COZY WHISPER-Hồng hạ","Son len mịn lì nịnh môi 3CE Cashmere Hug Lipstick"
"1773397937-456","https://shopee.vn/buyer/1363386527/rating?shop_id=1362679168","","Mình mua hộp kem gồm 1 cushion + 1 lõi, kèm quà tặng nhỏ.
Sau khi đặt hàng mình phát hiện chọn nhầm màu nhưng không huỷ được, nên khi hàng về mình không mở kiểm và bấm trả hàng ngay, giao nguyên hộp shop gửi cho shipper.

Tuy nhiên shop phản hồi rằng mỹ phẩm bị tác động, hộp bị méo và từ chối hoàn tiền, dù mình chưa hề mở hay sử dụng sản phẩm. Mình đã chấp nhận nhận lại hàng và chịu mất tiền để kết thúc vấn đề.

Nhưng điều không thể chấp nhận là sau 18 ngày kể từ khi shop thông báo gửi trả, mình mới nhận được hàng. Đóng gói rất sơ sài, gần như không bảo vệ sản phẩm. Khi mở ra thì THIẾU MẤT LÕI cushion, chỉ còn cushion và quà tặng nhỏ.

Trải nghiệm mua sắm rất tệ: xử lý thiếu thiện chí, giao hàng chậm, gửi thiếu sản phẩm. Mọi người nên cân nhắc kỹ trước khi mua.","2026-02-07 16:51","","(GWP) Túi Mini Đựng Son 3CE Lipstick Holder"
"1773397937-457","https://shopee.vn/buyer/1363386527/rating?shop_id=1362679168","","Trời ơi shop làm ăn không đàng hoàng nha. Mình lỡ bấm mua màu không hợp mà không huỷ đơn được nên khi nhận mình cũng chưa có khui hàng luôn mà bấm trả hàng . Để y hộp shop gửi để trả hàng vì này là mỹ phẩm nhạy cảm nên không dám khui nhưng shop lại báo lên hệ thống là hàng bị móp méo hư hỏng hộp. Ủa vậy ra shop gửi hàng cho mình không được đóng gói đàng hoàng à. Shop làm ăn vậy mất uy tín quá nha. Trong khi mình mua 1 cây son oke mình nhận chứ có gì đâu.","2026-01-19 16:37 | Phân loại hàng: Trung Tính - N02","Phân loại hàng: Trung Tính - N02","Phấn Nước Trang Điểm 3CE Fitting Mesh Cushion"
"1773397937-458","https://shopee.vn/buyer/1363386527/rating?shop_id=1362679168","","Màu rất nhạt phải đánh nhiều lần mới lên màu, dễ trôi, dù đã để ghi chú là giao main Korea nhưng vẫn giao main China, shop k để cho khách hàng biết là của TQ, chỉ khi hỏi thì mới trả lời cho qua nên rất ít người biết vì tưởng của Hàn nên k hỏi. Hàng Trung Quốc mà bán còn đắt hơn của Hàn nhiều, shoppe mall đóng gói rất ẩu.","2026-01-19 16:20 | Phân loại hàng: Lazy Talk","Phân loại hàng: Lazy Talk","Phấn Má Hồng Bắt Sáng 3CE Blushlighter"
"1773397937-459","https://shopee.vn/buyer/1363386527/rating?shop_id=1362679168","","","2026-01-19 14:20","","(GWP) Túi Mini Đựng Son 3CE Lipstick Holder"
"1773397937-460","https://shopee.vn/buyer/1363386527/rating?shop_id=1362679168","","Các bạn mua nên cân nhắc về màu, bị tối hơn so với hình ảnh đưa lên làm chìm da thật nữa. Trả hàng thì kêu mình bốc seal r, ko bốc s bt màu nó tối, cái đổi qua lý do miếng mút bị dơ, ko lấy miếng mút thử s bt nó tối tr","2026-01-19 14:19 | Phân loại hàng: Tông Lạnh - P02","Phân loại hàng: Tông Lạnh - P02","Phấn Nước Trang Điểm 3CE Fitting Mesh Cushion"
"1773397937-461","https://shopee.vn/buyer/1363386527/rating?shop_id=1362679168","","Lần đầu mình mua son 3ce vì giá hơi cao nhưng chất lượng k như mình mong muốn nền môi mộc của mình kh thâm nhưng đánh son lên set lại nhìn tím hồng rất sến, thoa son lên chưa kịp tán thì đã khô kh xê dịch dược, son nhẹ môi nhưng lại khô o","2026-01-19 13:55 | Phân loại hàng: Sepia-Đỏ táo trầm","Phân loại hàng: Sepia-Đỏ táo trầm","Son Kem 3CE Cho Viền Môi Mờ Ảo Không Lem Blur Water Tint 4.6g"
"1773397937-462","https://shopee.vn/buyer/1363386527/rating?shop_id=1362679168","","Quảng cáo thì màu đỏ giao về nâu trầm không dùng được, trên live thì kêu cho test thoải mái không ưng cho trả lại, trả lại kím đủ thứ lý do, điên k chịu dc, dùng 3ce lâu r lần đầu tiên gặp như thế này, bỏ hãng này ra khỏi danh sách, làm ăn vô hậu.","2026-01-19 12:58 | Phân loại hàng: 11-Soft Clay","Phân loại hàng: 11-Soft Clay","Son Sáp Màu Mịn Lì 3CE Sketch Stick"
"1773397937-463","https://shopee.vn/buyer/1363386527/rating?shop_id=1362679168","","","2026-01-19 12:03","","(GWP) Túi Mini Đựng Son 3CE Lipstick Holder"
"1773397937-464","https://shopee.vn/buyer/1363386527/rating?shop_id=1362679168","","","2026-01-19 12:03 | Phân loại hàng: #37 Raspberry Coate","Phân loại hàng: #37 Raspberry Coate","Son bóng dưỡng môi 3CE Glazy Lip Glow"
"1773397937-465","https://shopee.vn/buyer/1363386527/rating?shop_id=1362679168","","Ok","2026-01-19 11:19","","(GWP) Túi Mini Đựng Son 3CE Lipstick Holder"
"1773397937-466","https://shopee.vn/buyer/1363386527/rating?shop_id=1362679168","","Mua sale 15/1 mà đắt hơn bt","2026-01-19 11:19 | Phân loại hàng: Slick","Phân loại hàng: Slick","Phấn Má Hồng Bắt Sáng 3CE Blushlighter"
"1773397937-467","https://shopee.vn/buyer/1363386527/rating?shop_id=1362679168","","Mua sale 15/1 mà đắt hơn bt 
K có lõi mà hơn 700k mình nghĩ có lõi nên đã đặt mua","2026-01-19 11:19 | Phân loại hàng: Trung Tính - N02","Phân loại hàng: Trung Tính - N02","Phấn Nước Trang Điểm 3CE Fitting Mesh Cushion"
"1773397937-468","https://shopee.vn/buyer/1363386527/rating?shop_id=1362679168","","Mua sale 15/1 mà đắt hơn bt","2026-01-19 11:19","","Chai Xịt Cố Định Lớp Trang Điểm 3CE 3CE Shimmer Makeup Fixer"
"1773397937-469","https://shopee.vn/buyer/1363386527/rating?shop_id=1362679168","","không có đẹp bằng son tin nha huhu hởm h sài tin của 3ce nay đổi qua nhung nó bết nó lộ viền môi mặc dù có tẩy da dưỡng môi đồ huhu","2026-01-19 10:25 | Phân loại hàng: WHIP RED-Đỏ mận","Phân loại hàng: WHIP RED-Đỏ mận","Son kem bùn mịn lì 3CE Hazy Lip Clay"
"1773397937-470","https://shopee.vn/buyer/1363386527/rating?shop_id=1362679168","","","2026-01-19 09:06","","(GWP) Túi Mini Đựng Son 3CE Lipstick Holder"
"1773397937-471","https://shopee.vn/buyer/1363386527/rating?shop_id=1362679168","","Đặt đỏ cam giao màu hồng??","2026-01-19 09:06 | Phân loại hàng: Play Off-Đỏ cam","Phân loại hàng: Play Off-Đỏ cam","Son Kem 3CE Cho Viền Môi Mờ Ảo Không Lem Blur Water Tint 4.6g"
"1773397937-472","https://shopee.vn/buyer/1363386527/rating?shop_id=1362679168","","","2026-01-19 09:03","","(GWP) Túi Mini Đựng Son 3CE Lipstick Holder"
"1773397937-473","https://shopee.vn/buyer/1363386527/rating?shop_id=1362679168","","Trong đơn thì có son mini tặng kèm, nhưng khi giao hàng thì không có, người đổ shopee, shopee thì loằng ngoằng, quá tệ","2026-01-19 09:03","","(GWP) Son Kem Mịn Mờ Môi 3CE Blur Water Tint Mini #Laydown"
"1773397937-474","https://shopee.vn/buyer/1363386527/rating?shop_id=1362679168","","","2026-01-19 09:03","","Chai Xịt Cố Định Lớp Trang Điểm 3CE 3CE Shimmer Makeup Fixer"
"1773397937-475","https://shopee.vn/buyer/1363386527/rating?shop_id=1362679168","","","2026-01-19 09:03 | Phân loại hàng: Pink Guava-Hồng đào","Phân loại hàng: Pink Guava-Hồng đào","Son Kem 3CE Cho Viền Môi Mờ Ảo Không Lem Blur Water Tint 4.6g"
"1773397937-476","https://shopee.vn/buyer/1363386527/rating?shop_id=1362679168","","Mascara thì được nhưng má hồng thì chán. Nó quá nhạt nhoà. Mà dùng chổi lấy phấn nó cứ vụn ra thành bột, sau bôi lên má nó ko dính tẹo nào. Hàng dùng chán thế. Đừng ai mua má hồng của hãng này. Kém lắm.","2026-01-26 07:01","","Mascara Siêu Mỏng Chống Nước 3CE Super Slim Waterproof Mascara - Black"
"1773397937-477","https://shopee.vn/buyer/1363386527/rating?shop_id=1362679168","","Phấn màu nhạt. Dùng chán lắm. Dùng cọ lấy phấn nó cứ bột bột , ko bám vào má. Nói chung là hàng kém chất lượng. Đừng ai mua nhé","2026-01-26 07:02 | Phân loại hàng: Mono Pink-Hồng khô","Phân loại hàng: Mono Pink-Hồng khô","Phấn Má Hồng Mịn Lì 3CE Face Blush"
"1773397937-478","https://shopee.vn/buyer/1363386527/rating?shop_id=1362679168","","","2026-01-19 04:23","","(GWP) Túi Mini Đựng Son 3CE Lipstick Holder"
"1773397937-479","https://shopee.vn/buyer/1363386527/rating?shop_id=1362679168","","","2026-01-19 04:23 | Phân loại hàng: COZY WHISPER-Hồng hạ","Phân loại hàng: COZY WHISPER-Hồng hạ","Son len mịn lì nịnh môi 3CE Cashmere Hug Lipstick"
"1773397937-480","https://shopee.vn/buyer/1363386527/rating?shop_id=1362679168","","Tưởng đâu tìm đc màu chân ái rồi nhưng mà ko, màu khác ảnh, như kiểu đỏ đất vậy =)))
Mình để ý mua ở hãng cũng hên xui, có lúc mua thì đúng màu có lúc mua k đúng màu, như có ng mua thì dc màu đỏ hồng tươi có ng như m mua thì màu sẫm nâu
M mua bên intoyou lâu lâu cũng vậy, cùng 1 mã mà lúc màu ok lúc màu khác hẳn




Với khả năng nhận biết chữ cái Latin, Hán tự, con số và màu sắc, Ai-chan là một trong những chú tinh tinh có năng lực nhận thức đặc biệt nhất từng được nghiên cứu, góp phần quan trọng cho các lĩnh vực nghiên cứu về trí tuệ của loài linh trưởng","2026-01-18 23:52 | Phân loại hàng: #01 Speak Up","Phân loại hàng: #01 Speak Up","Son Kem Lì Nhung Mịn 3CE Velvet Lip Tint Plush"
"1773397937-481","https://shopee.vn/buyer/1363386527/rating?shop_id=1362679168","","","2026-02-02 08:36 | Phân loại hàng: Laydown-Hồng trầm","Phân loại hàng: Laydown-Hồng trầm","Son Kem 3CE Cho Viền Môi Mờ Ảo Không Lem Blur Water Tint 4.6g"
"1773397937-482","https://shopee.vn/buyer/1363386527/rating?shop_id=1362679168","","Bực, lỡ bóc rồi chứ ko cũng trả hàng. Hàng fake trung quốc mà bán với giá đấy, 310k ngang với 3ce thật rồi, lừa đấy mọi người đừng mua. Mình đã dùng hết 1 cây 3ce đúng loại này màu này y hệt (mua ở cửa hàng), hết mà ngại đi nên tin tưởng đặt ship ở đây. vậy mà giờ cầm 2 cây son cũ (mua cửa hàng) và mới (mua shopee) thất tem dán dưới đít khác nhau hoàn toàn nha. 1 cái made in Korea, phông chữ khác hẳn, còn đây made in China, phông chữ thì nhìn dại dại đểu đểu. Cạch ra nha, chính hãng con khỉ, mà đắt so với fake","2026-01-18 22:46 | Phân loại hàng: Pink Guava-Hồng đào","Phân loại hàng: Pink Guava-Hồng đào","Son Kem 3CE Cho Viền Môi Mờ Ảo Không Lem Blur Water Tint 4.6g"
"1773397937-483","https://shopee.vn/buyer/1363386527/rating?shop_id=1362679168","","","2026-01-18 22:35","","(GWP) Gương Pha Lê 3CE"
"1773397937-484","https://shopee.vn/buyer/1363386527/rating?shop_id=1362679168","","","2026-01-18 22:25","","Chai Xịt Cố Định Lớp Trang Điểm 3CE 3CE Shimmer Makeup Fixer"
"1773397937-485","https://shopee.vn/buyer/1363386527/rating?shop_id=1362679168","","","2026-01-18 20:56 | Phân loại hàng: Middy Hype","Phân loại hàng: Middy Hype","Phấn Má Hồng Bắt Sáng 3CE Blushlighter"
"1773397937-486","https://shopee.vn/buyer/1363386527/rating?shop_id=1362679168","","","2026-01-18 20:56","","Chai Xịt Cố Định Lớp Trang Điểm 3CE 3CE Shimmer Makeup Fixer"
"1773397937-487","https://shopee.vn/buyer/1363386527/rating?shop_id=1362679168","","","2026-01-18 20:36","","(GWP) Son Kem Mịn Mờ Môi 3CE Blur Water Tint Mini #Laydown"
"1773397937-488","https://shopee.vn/buyer/1363386527/rating?shop_id=1362679168","","Hàng tặng nhưng cx cần phải chỉnh chu tặng cái gương xước k buồn dùng luôn í=))","2026-01-18 19:22","","(GWP) Gương Pha Lê 3CE"
"1773397937-489","https://shopee.vn/buyer/1363386527/rating?shop_id=1362679168","","Son thỏi bị hỏng chỗ vặn, không vặn dc xuống","2026-01-18 19:14 | Phân loại hàng: RAIN OR SHINE-Pha lê","Phân loại hàng: RAIN OR SHINE-Pha lê","Son bóng dưỡng môi bắt sáng 3CE Shine Reflector (Son vặn 1 chiều)"
"1773397937-490","https://shopee.vn/buyer/1363386527/rating?shop_id=1362679168","","","2026-01-18 17:10","","(GWP) Son Kem Mịn Mờ Môi 3CE Blur Water Tint Mini #Casual A"
"1773397937-491","https://shopee.vn/buyer/1363386527/rating?shop_id=1362679168","","để có hàng tặng nhưng giao lại ko có nhắn mà trả lời dài dòng không xử lí đc vấn đề đó nói chung rất bực bội bà không hài lòng đến một cái brand lớn và nổi tiếng như 3ce mà lại làm việc chậm chạp nói. Hàng hoá đóng móp méo dơ","2026-01-18 17:10","","Chai Xịt Cố Định Lớp Trang Điểm 3CE 3CE Shimmer Makeup Fixer"
"1773397937-492","https://shopee.vn/buyer/1363386527/rating?shop_id=1362679168","","Sài bị chăm chít cái môi lắm :)) sài son nào cũng ko sao mỗi son này bị đã thử cho 2 người nhà mình cũng bị y như vậy luôn chăm chít khó chịu lắm mà ko duoc hoàn hàng đâu lưu ý khi mua","2026-01-18 16:53 | Phân loại hàng: Sepia-Đỏ táo trầm","Phân loại hàng: Sepia-Đỏ táo trầm","Son Kem 3CE Cho Viền Môi Mờ Ảo Không Lem Blur Water Tint 4.6g"
"1773397937-493","https://shopee.vn/buyer/1363386527/rating?shop_id=1362679168","","","2026-01-18 15:49 | Phân loại hàng: Play Off-Đỏ cam","Phân loại hàng: Play Off-Đỏ cam","Son Kem 3CE Cho Viền Môi Mờ Ảo Không Lem Blur Water Tint 4.6g"
"1773397937-494","https://shopee.vn/buyer/1363386527/rating?shop_id=1362679168","","Chất son như nước không lên màu, màu lên nham nhở, chất lượng quá tệ. Cứ ngở là hàng fake ko. Ko nên mua","2026-01-18 15:27 | Phân loại hàng: 05 - Coral Drench","Phân loại hàng: 05 - Coral Drench","Son Pha Lê 3CE Misty Lip Bare"
"1773397937-495","https://shopee.vn/buyer/1363386527/rating?shop_id=1362679168","","Shop gửi hàng đã qua sử dụng và bóc tem cho khách?","2026-01-18 14:50","","Chai Xịt Cố Định Lớp Trang Điểm 3CE 3CE Shimmer Makeup Fixer"
"1773397937-496","https://shopee.vn/buyer/1363386527/rating?shop_id=1362679168","","","2026-01-18 14:35 | Phân loại hàng: #08 Figtachio","Phân loại hàng: #08 Figtachio","Son Kem Lì Nhung Mịn 3CE Velvet Lip Tint Plush"
"1773397937-497","https://shopee.vn/buyer/1363386527/rating?shop_id=1362679168","","","2026-01-18 13:34","","(GWP) Túi Mini Đựng Son 3CE Lipstick Holder"
"1773397937-498","https://shopee.vn/buyer/1363386527/rating?shop_id=1362679168","","Huhu sao lại made in china ạ màu cũng khác luôn bản korea em còn thấy thơm hơn nữa lúc giao hàng thì hộp mở đã từng mở luôn rồi cơ","2026-01-18 12:37 | Phân loại hàng: City Mauve-Hồng khói","Phân loại hàng: City Mauve-Hồng khói","Phấn Má Hồng Mịn Lì 3CE Face Blush"
"1773397937-499","https://shopee.vn/buyer/1363386527/rating?shop_id=1362679168","","Vê sd dc 2 lân thỏi son rơi ra, k lì , thât vong vê lân mua này","2026-01-18 11:26 | Phân loại hàng: 05-High Standard","Phân loại hàng: 05-High Standard","Son Sáp Màu Mịn Lì 3CE Sketch Stick"
"1773397937-500","https://shopee.vn/buyer/1363386527/rating?shop_id=1362679168","","","2026-01-17 22:51 | Phân loại hàng: Play Off-Đỏ cam","Phân loại hàng: Play Off-Đỏ cam","Son Kem 3CE Cho Viền Môi Mờ Ảo Không Lem Blur Water Tint 4.6g"
"1773397937-501","https://shopee.vn/buyer/1363386527/rating?shop_id=1362679168","","Shop gởi hàng thiếu quà tặng, nt shop thì trả lời hiện chưa có chính sách bù hàng tặng nên ko gởi 1 thương hiệu có tiếng mà xử lý tệ trả lời vô trách nhiệm với thiếu chuyên nghiệp. Khi chị hannaholala live ra rả quà tặng mọi người ơi mua đi quà xinh lắm vậy mà ko gởi cho khách!
Còn về màu son thì ta nói đánh mây lần mới có màu chưa thấy cây son nào của hãng 6 như son này, mình ko dùng hãng này chỉ mua cho con thôi nhưng mà khuyên thật lòng ce là nó 6 hoắc","2026-01-17 21:45 | Phân loại hàng: 11 - Rose Sigh","Phân loại hàng: 11 - Rose Sigh","Son Pha Lê 3CE Misty Lip Bare"
"1773397937-502","https://shopee.vn/buyer/1363386527/rating?shop_id=1362679168","","Đánh ko lên màu","2026-01-19 12:41 | Phân loại hàng: 05 - Coral Drench","Phân loại hàng: 05 - Coral Drench","Son Pha Lê 3CE Misty Lip Bare"
"1773397937-503","https://shopee.vn/buyer/1363386527/rating?shop_id=1362679168","","Màu này làm lớp son bóng thì ok hơn
Nhưng đánh thì vẫn ko ăn môi, như nước trôi í","2026-01-19 12:41","","(GWP) Túi Mini Đựng Son 3CE Lipstick Holder"
"1773397937-504","https://shopee.vn/buyer/1363386527/rating?shop_id=1362679168","","Dùng ko thấy cái màu gì luôn. Cứ bị rụng kim tuyến vào mắt. Bé tí tẹo","2026-01-18 12:06 | Phân loại hàng: MAUVE LIKE","Phân loại hàng: MAUVE LIKE","Phấn mắt 3 ô 3CE Color Grid Eyeshadow"
"1773397937-505","https://shopee.vn/buyer/1363386527/rating?shop_id=1362679168","","","2026-01-17 16:45","","(GWP) Túi Mini Đựng Son 3CE Lipstick Holder"
"1773397937-506","https://shopee.vn/buyer/1363386527/rating?shop_id=1362679168","","Lần đầu đánh giá 1 sao .mua đỏ cảm giao đỏ rượu, nt hỗ trợ nhưng kỉ thấy phản hồi. Khi nào đổi đúng màu sẽ quay lại đánh giá","2026-01-17 16:45 | Phân loại hàng: Play Off-Đỏ cam","Phân loại hàng: Play Off-Đỏ cam","Son Kem 3CE Cho Viền Môi Mờ Ảo Không Lem Blur Water Tint 4.6g"
"1773397937-507","https://shopee.vn/buyer/1363386527/rating?shop_id=1362679168","","just posted another photo on my profile for the week with a few of the other people in my life who i","2026-01-17 16:02","","(GWP) Túi Mini Đựng Son 3CE Lipstick Holder"
"1773397937-508","https://shopee.vn/buyer/1363386527/rating?shop_id=1362679168","","Màu ko đẹp, nhanh trôi
Nch ko nên mua","2026-01-17 13:48 | Phân loại hàng: #08 Figtachio","Phân loại hàng: #08 Figtachio","Son Kem Lì Nhung Mịn 3CE Velvet Lip Tint Plush"
"1773397937-509","https://shopee.vn/buyer/1363386527/rating?shop_id=1362679168","","Giao sai màu","2026-01-17 12:28 | Phân loại hàng: 09 - Driftwood","Phân loại hàng: 09 - Driftwood","Son Pha Lê 3CE Misty Lip Bare"
"1773397937-510","https://shopee.vn/buyer/1363386527/rating?shop_id=1362679168","","igói hàng quá kém cỏi. để miếng giấy gói hàng cho có chứ ko bao bọc lại cây son. hộp méo mó hư hại tới trong.  mall lớn làm ăn cẩu thả. cây son củng đâu có rẻ đâu. quấn bao chống sốc rồi dán băng kẹo lại củng ko mất nhiều thời gian nữa. không tôn trọng khách hàng","2026-01-17 11:45 | Phân loại hàng: 11 - Rose Sigh","Phân loại hàng: 11 - Rose Sigh","Son Pha Lê 3CE Misty Lip Bare"
"1773397937-511","https://shopee.vn/buyer/1363386527/rating?shop_id=1362679168","","Giao thiếu quà tặng, nhắn tin hỏi thì shop chỉ nói thông cảm chứ ko hề có ý định bù cho người mua.
Cạch mặt lun shop","2026-01-17 11:38","","(GWP) Túi Mini Đựng Son 3CE Lipstick Holder"
"1773397937-512","https://shopee.vn/buyer/1363386527/rating?shop_id=1362679168","","Giao thiếu quà tặng, nhắn tin hỏi thì shop chỉ nói thông cảm chứ ko hề có ý định bù cho người mua.
Cạch mặt lun shop","2026-01-17 11:38 | Phân loại hàng: KNIT-Hồng khô","Phân loại hàng: KNIT-Hồng khô","Son len mịn lì nịnh môi 3CE Cashmere Hug Lipstick"
"1773397937-513","https://shopee.vn/buyer/1363386527/rating?shop_id=1362679168","","Đã bị bóc hàng ra rồi . K còn seal .","2026-01-17 10:50","","Chai Xịt Cố Định Lớp Trang Điểm 3CE 3CE Shimmer Makeup Fixer"
"1773397937-514","https://shopee.vn/buyer/1363386527/rating?shop_id=1362679168","","Mình mua trong live c Hanah, mình đặt rất sớm khi chị bắt đầu live. Hiển thị mua 1 sẽ được tặng quà. Nhưng khi mình nhận thì không có quà. Mình báo shop thì báo số lượng có hạn. Xong rồi báo mình không check trong giỏ hàng. Trong khi đó lúc mua thì không báo như vậy. Cảm thấy chuyện tặng quà chỉ là hiển thị chơi thôi chứ ai hên mới nhận","2026-01-17 09:35 | Phân loại hàng: Middy Hype","Phân loại hàng: Middy Hype","Phấn Má Hồng Bắt Sáng 3CE Blushlighter"
"1773397937-515","https://shopee.vn/buyer/1363386527/rating?shop_id=1362679168","","","2026-01-17 08:00","","(GWP) Túi Mini Đựng Son 3CE Lipstick Holder"
"1773397937-516","https://shopee.vn/buyer/1363386527/rating?shop_id=1362679168","","Đặt màu đỏ cam mà tô ra màu Hồng cánh sen","2026-01-17 08:00 | Phân loại hàng: Play Off-Đỏ cam","Phân loại hàng: Play Off-Đỏ cam","Son Kem 3CE Cho Viền Môi Mờ Ảo Không Lem Blur Water Tint 4.6g"
"1773397937-517","https://shopee.vn/buyer/1363386527/rating?shop_id=1362679168","","Hàng lỗi nhưng lại k duyệt","2026-01-17 08:00 | Phân loại hàng: Laydown-Hồng trầm","Phân loại hàng: Laydown-Hồng trầm","Son Kem 3CE Cho Viền Môi Mờ Ảo Không Lem Blur Water Tint"
"1773397937-518","https://shopee.vn/buyer/1363386527/rating?shop_id=1362679168","","","2026-01-17 07:15 | Phân loại hàng: Sepia-Đỏ táo trầm","Phân loại hàng: Sepia-Đỏ táo trầm","Son Kem 3CE Cho Viền Môi Mờ Ảo Không Lem Blur Water Tint"
"1773397937-519","https://shopee.vn/buyer/1363386527/rating?shop_id=1362679168","","Chào khách  hàng, yêu cầu thay đổi thông tin đơn hàng của bạn đã được xử lý, xin hãy lựa  chọn thông tin chính xác để lên đơn lại :D Mẫu này đang rất hot, hàng trong  kho có hạn, mau chóng lên đơn, tôi sẽ cố gắng gửi hàng cho bạn nhanh nhất :)","2026-01-16 21:55","","(GWP) Túi Mini Đựng Son 3CE Lipstick Holder"
